{
  "name": "dx",
  "description": "Developer experience essentials: GitHub Actions debugging, conversation cloning/half-cloning, context handoffs, and Reddit research via Gemini CLI",
  "version": "0.14.11",
  "author": {
    "name": "YK",
    "email": "yoyoyosss@wearehackerone.com"
  },
  "repository": "https://github.com/ykdojo/claude-code-tips",
  "license": "All Rights Reserved",
  "keywords": ["developer", "github-actions", "productivity", "workflow", "devtools"]
}
